{"bootstrap":{"confidence_level":0.95,"estimator":"median-paired-speedup","method":"percentile","percentile_method":"linear-r7","resamples":10000,"seed":20260824},"engines":{"comet_accelerated":{"iqr":995.417138499999,"max":11610.529856,"mean":9492.2457652,"median":9318.1544785,"min":8103.653271,"n":10,"p95":null,"q1":8969.686833250002,"q3":9965.10397175,"stddev":965.5997445065819},"spark_baseline":{"iqr":860.3097362500048,"max":43323.43771,"mean":42209.8627071,"median":42206.175547499995,"min":40722.4129,"n":10,"p95":null,"q1":41821.21452925,"q3":42681.524265500004,"stddev":733.2617524432114}},"experiment_id":"EXP-TPCH-SF10-R2-Q01","n_failed":0,"n_succeeded":20,"n_total":20,"paired_failures":[],"paired_resource_savings":{"cgroup_memory_peak_mib":{"absolute_delta":{"iqr":0.0,"max":253.56640625,"mean":25.28203125,"median":0.0,"min":-0.74609375,"n":10,"p95":null,"q1":0.0,"q3":0.0,"stddev":80.21129595786651},"excluded_pair_ids":[],"relative_saving_ratio":{"iqr":0.0,"max":0.13152317505085626,"mean":0.013115505253351497,"median":0.0,"min":-0.00036812251734126886,"n":10,"p95":null,"q1":0.0,"q3":0.0,"stddev":0.04160437518277113},"unit":"MiB","zero_baseline_pair_ids":[]},"cpu_core_seconds":{"absolute_delta":{"iqr":1.0086703500000027,"max":74.9630796,"mean":73.26613164,"median":73.33196765,"min":71.1285351,"n":10,"p95":null,"q1":72.67646265,"q3":73.68513300000001,"stddev":1.159231658443412},"excluded_pair_ids":[],"relative_saving_ratio":{"iqr":0.00013154196587994438,"max":0.9972559303637263,"mean":0.9969794113243534,"median":0.9970020764388584,"min":0.9965183018513601,"n":10,"p95":null,"q1":0.996953314436063,"q3":0.997084856401943,"stddev":0.00019594426850442733},"unit":"seconds","zero_baseline_pair_ids":[]},"disk_spill_mb":{"absolute_delta":{"iqr":0.0,"max":0.0,"mean":0.0,"median":0.0,"min":0.0,"n":10,"p95":null,"q1":0.0,"q3":0.0,"stddev":0.0},"excluded_pair_ids":[],"relative_saving_ratio":{"iqr":null,"max":null,"mean":null,"median":null,"min":null,"n":0,"p95":null,"q1":null,"q3":null,"stddev":null},"unit":"MiB","zero_baseline_pair_ids":[1,2,3,4,5,6,7,8,9,10]},"jvm_gc_time_ms":{"absolute_delta":{"iqr":894.0,"max":3347.0,"mean":2480.7,"median":2508.0,"min":1782.0,"n":10,"p95":null,"q1":1988.25,"q3":2882.25,"stddev":531.4194932233647},"excluded_pair_ids":[],"relative_saving_ratio":{"iqr":0.0025635495430494926,"max":1.0,"mean":0.9946230823352111,"median":0.9937238898103231,"min":0.991701244813278,"n":10,"p95":null,"q1":0.9924615096861785,"q3":0.995025059229228,"stddev":0.003052435289526002},"unit":"ms","zero_baseline_pair_ids":[]},"shuffle_read_mb":{"absolute_delta":{"iqr":0.0,"max":-0.062221,"mean":-0.06222099999999999,"median":-0.062221,"min":-0.062221,"n":10,"p95":null,"q1":-0.062221,"q3":-0.062221,"stddev":0.0},"excluded_pair_ids":[],"relative_saving_ratio":{"iqr":0.0,"max":-3.6476140227459255,"mean":-3.6476140227459255,"median":-3.6476140227459255,"min":-3.6476140227459255,"n":10,"p95":null,"q1":-3.6476140227459255,"q3":-3.6476140227459255,"stddev":0.0},"unit":"MiB","zero_baseline_pair_ids":[]},"shuffle_write_mb":{"absolute_delta":{"iqr":0.0,"max":-0.062221,"mean":-0.06222099999999999,"median":-0.062221,"min":-0.062221,"n":10,"p95":null,"q1":-0.062221,"q3":-0.062221,"stddev":0.0},"excluded_pair_ids":[],"relative_saving_ratio":{"iqr":0.0,"max":-3.6476140227459255,"mean":-3.6476140227459255,"median":-3.6476140227459255,"min":-3.6476140227459255,"n":10,"p95":null,"q1":-3.6476140227459255,"q3":-3.6476140227459255,"stddev":0.0},"unit":"MiB","zero_baseline_pair_ids":[]}},"paired_speedup":{"iqr":0.560427444548588,"max":5.289926185071104,"mean":4.486422052615788,"median":4.5109782379721395,"min":3.7313919560364983,"n":10,"p95":null,"q1":4.1675328578932325,"q3":4.72796030244182,"stddev":0.4497618717038069},"paired_speedup_ci":{"confidence_level":0.95,"lower":4.154844121048997,"method":"percentile","percentile_method":"linear-r7","resamples":10000,"seed":20260824,"upper":4.788276105842593},"percentile_method":"linear-r7","query_id":"Q01","ratio_of_medians":4.529456518979516,"schema_version":1,"storage_profile":"tpch_iceberg","workload":"tpch"}
